A1: Liga de Outono 2003 | B1: 1 | C1: 2 | D1: 3 | E1: 4 | F1: 5 | G1: PUNTOS
A2: Arteixo | B2: XXX | C2: 1.5 | D2: 2 | E2: 2,5 | F2: 3 | G2: 9
A3: Círculo Ferrolano | B3: 2.5 | C3: XXX | D3: 3 | E3: 4 | F3: 4 | G3: 13,5
A4: Sagrada Familia | B4: 2 | C4: 1 | D4: XXX | E4: 2.5 | F4: 4 | G4: 9,5
A5: Sigrás | B5: 1,5 | C5: 0 | D5: 1.5 | E5: XXX | F5: 3 | G5: 6
A6: Brigantium | B6: 1 | C6: 0 | D6: 0 | E6: 1 | F6: XXX | G6: 2

A1: F. SANTIAGO | B1: 1 | C1: 2 | D1: 3 | E1: 4 | F1: TOTAL
A2: A ESTRADA "A" | B2: XXX | C2: 2 | D2: 3 | E2: 3 | F2: 8
A3: A ESTRADA "B" | B3: 1 | C3: XXX | D3: 3 | E3: 3 | F3: 7
A4: TILOS "A" | B4: 0 | C4: 0 | D4: XXX | E4: 2.5 | F4: 2.5
A5: TILOS "B" | B5: 0 | C5: 0 | D5: 0.5 | E5: XXX | F5: 0.5

A6: Rolda 1ª - 15/11/2003 11:15 h
A7: 1 | B7: Matama | C7: =SUM(C4:C7) -> 3 | D7: - | E7: =SUM(E4:E7) -> 1 | F7: Bouzas | G7: 0
B8: Esteban Abalde Fernández | C8: 1 | D8: - | E8: 0 | F8: Alejandro Martínez Martínez
B9: Iván Acuña Celada | C9: 1 | D9: - | E9: 0 | F9: Carlos Fernández García
B10: Jaime Costas Rodríguez | C10: 1 | D10: - | E10: 0 | F10: Carlos Cortes Queimaliños
B11: Pablo González Comesaña | C11: 0 | D11: - | E11: 1 | F11: Iván Perez Piñeiro
A12: 0 | B12: Don Bosco | C12: =SUM(C11:C14) -> 0 | D12: - | E12: =SUM(E11:E14) -> 4 | F12: Escola Provincial | G12: 1
B13: Alejandro Iglesias Rey | C13: 0 | D13: - | E13: 1 | F13: José Luís Cebrián Ramos
B14: Iago Fernández Suárez | C14: 0 | D14: - | E14: 1 | F14: Alberto Pérez Costa
B15: Alejandro Fernández Reza | C15: 0 | D15: - | E15: 1 | F15: Roi Cabanas Rodríguez
B16: Germán Otero García | C16: 0 | D16: - | E16: 1 | F16: Juan José Iglesias-Ucha Martín
A17: 1 | B17: Laroca | C17: =SUM(C18:C21) -> 4 | D17: - | E17: =SUM(E18:E21) -> 0 | F17: Altamar | G17: 0
B18: Patricio Salgado Alonso | C18: 1 | D18: - | E18: 0 | F18: Borja Aguiar Saco
B19: Sergio López Pérez | C19: 1 | D19: - | E19: 0 | F19: Alejandro de Frutos Martínez
B20: Miguel Calvo Marques | C20: 1 | D20: - | E20: 0 | F20: Carlos González Aguiar
B21: Carlos Carreira Fernández | C21: 1 | D21: - | E21: 0 | F21: Yeray Lage Freitas
A22: 1 | B22: A.C.D. de Vigo | C22: =SUM(C25:C28) -> 4 | D22: - | E22: =SUM(E25:E28) -> 0 | F22: Ría de Vigo | G22: 0
B23: Esteban Vázquez Ríos | C23: 1 | D23: - | E23: 0 | F23: Diego Méndez Fernández
B24: Javier Pérez Piñeiro | C24: 1 | D24: - | E24: 0 | F24: Sergío Alonso Suárez
B25: Lucas Castellano Ostapczuk | C25: 1 | D25: - | E25: 0 | F25: Jacobo Alonso Domínguez
B26: Julio Fernández Echevarría | C26: 1 | D26: - | E26: 0 | F26: Borja Barreiro Ponsot
A27: Rolda 2ª - 15/11/2003 12:30 h
A28: 0 | B28: A.C.D. de Vigo | C28: =SUM(C34:C37) -> 0 | D28: - | E28: =SUM(E34:E37) -> 4 | F28: Matamá | G28: 1
B29: Esteban Vázquez Ríos | C29: 0 | D29: - | E29: 1 | F29: Esteban Abalde Fernández
B30: Javier Pérez Piñeiro | C30: 0 | D30: - | E30: 1 | F30: Iván Acuña Celada
B31: Lucas Castellano Ostapczuk | C31: 0 | D31: - | E31: 1 | F31: Jaime Costas Rodríguez
B32: Julio Fernández Echevarría | C32: 0 | D32: - | E32: 1 | F32: Pablo González Comesaña
A33: 1 | B33: Escola Provincial | C33: =SUM(C41:C44) -> 3 | D33: - | E33: =SUM(E41:E44) -> 1 | F33: Laroca | G33: 0
B34: José Luís Cebrián Ramos | C34: 1 | D34: - | E34: 0 | F34: Patricio Salgado Alonso
B35: Alberto Pérez Costa | C35: 1 | D35: - | E35: 0 | F35: Sergio López Pérez
B36: Roi Cabanas Rodríguez | C36: 0 | D36: - | E36: 1 | F36: Miguel Calvo Marques
B37: Juan José Iglesias-Ucha Martín | C37: 1 | D37: - | E37: 0 | F37: Carlos Carreira Fernández
A38: 1 | B38: Bouzas | C38: =SUM(C48:C51) -> 4 | D38: - | E38: =SUM(E48:E51) -> 0 | F38: Ría de Vigo | G38: 0
B39: Alejandro Martínez Martínez | C39: 1 | D39: - | E39: 0 | F39: Diego Méndez Fernández
B40: Carlos Fernández García | C40: 1 | D40: - | E40: 0 | F40: Sergio Alonso Suárez
B41: Carlos Cortes Queimaliños | C41: 1 | D41: - | E41: 0 | F41: Jacobo Alonso Domínguez
B42: Iván Perez Piñeiro | C42: 1 | D42: - | E42: 0 | F42: Borja Barreiro Ponsot
A43: 0 | B43: Altamar | C43: =SUM(C55:C58) -> 1 | D43: - | E43: =SUM(E55:E58) -> 3 | F43: Don Bosco | G43: 1
B44: Borja Aguiar Saco | C44: 0 | D44: - | E44: 1 | F44: Alejandro Iglesias Rey
B45: Alejandro de Frutos Martínez | C45: 1 | D45: - | E45: 0 | F45: Iago Fernández Suárez
B46: Carlos González Aguiar | C46: 0 | D46: - | E46: 1 | F46: Alejandro Fernández Reza
B47: Yeray Lage Freitas | C47: 0 | D47: - | E47: 1 | F47: Germán Otero García

A1: C. Ferrolano | B1: 3 - 1 | C1: Escola Provincial | E1: A Estrada "A" | F1: 1 - 3 | G1: C.D.U.
A2: Jacobo Caselas (B) | B2: 0.5 - 0.5 | C2: Daniel Taboas (N) | E2: Basilio Guijarro (B) | F2: 0 - 1 | G2: Rodney Pérez (N)
A3: Manuel Bueno | B3: 0.5 - 0.5 | C3: David Tolles | E3: Gabriel Guijarro | F3: 0 - 1 | G3: Roberto Patiño
A4: Xoel Pérez | B4: 1 - 0 | C4: José Luis Cebrián | E4: Enrique Bazala | F4: 0 - 1 | G4: Fernando Sánchez
A5: Walter López | B5: 1 - 0 | C5: Alberto Pérez | E5: Xoan X. Hidalgo | F5: 1 - 0 | G5: Xosé Sánchez

A1: C. Ferrolano | B1: 2.5 - 1.5 | C1: C.D.U. | E1: Escola Provincial | F1: 2 - 1 | G1: A Estrada "A"
A2: Jacobo Caselas (B) | B2: 1 - 0 | C2: Rodney Pérez (N) | E2: Daniel Taboas (B) | F2: 1- 0 | G2: Basilio Guijarro (N)
A3: Manuel Bueno | B3: 0.5 - 0.5 | C3: Roberto Patiño | E3: José Luis Cebrián | F3: 1 - 0 | G3: Gabriel Guijarro
A4: Xoel Pérez | B4: 0 - 1 | C4: Fernando Sánchez | E4: ???????? | F4: ? - ? | G4: Enrique Bazala
A5: Walter López | B5: 1 - 0 | C5: Xosé Sánchez | E5: Alberto Pérez | F5: 0 - 1 | G5: Xoan X. Hidalgo