A1: Nº | B1: JUGADOR | C1: 1 | D1: 2 | E1: 3 | F1: 4 | G1: 5 | H1: 6 | I1: Puntos | J1: Sonnen
A2: 1 | B2: Óscar González | C2: XXX | D2: 1 | E2: 0 | F2: 0 | G2: 0 | H2: 0 | I2: =SUM(C2:H2) -> 1 | J2: =C2*I$2+D2*I$3+E2*I$4+F2*I$5+G2*I$6+H2*I$7 -> 2
A3: 2 | B3: Juan A. Gutiérrez | C3: 0 | D3: XXX | E3: 1 | F3: 1 | G3: 0 | H3: 0 | I3: =SUM(C3:H3) -> 2 | J3: =C3*I$2+D3*I$3+E3*I$4+F3*I$5+G3*I$6+H3*I$7 -> 5
A4: 3 | B4: Jesús Rodríguez | C4: 1 | D4: 0 | E4: XXX | F4: 0 | G4: 0 | H4: 0 | I4: =SUM(C4:H4) -> 1 | J4: =C4*I$2+D4*I$3+E4*I$4+F4*I$5+G4*I$6+H4*I$7 -> 1
A5: 4 | B5: Santiago Domínguez | C5: 1 | D5: 0 | E5: 1 | F5: XXX | G5: 1 | H5: 1 | I5: =SUM(C5:H5) -> 4 | J5: =C5*I$2+D5*I$3+E5*I$4+F5*I$5+G5*I$6+H5*I$7 -> 9
A6: 5 | B6: Ernesto Pérez | C6: 1 | D6: 1 | E6: 1 | F6: 0 | G6: XXX | H6: 1 | I6: =SUM(C6:H6) -> 4 | J6: =C6*I$2+D6*I$3+E6*I$4+F6*I$5+G6*I$6+H6*I$7 -> 7
A7: 6 | B7: Héctor López | C7: 1 | D7: 1 | E7: 1 | F7: 0 | G7: 0 | H7: XXX | I7: =SUM(C7:H7) -> 3 | J7: =C7*I$2+D7*I$3+E7*I$4+F7*I$5+G7*I$6+H7*I$7 -> 4