A1: Nº | B1: JUGADOR | C1: 1 | D1: 2 | E1: 3 | F1: 4 | G1: Puntos | H1: Sonnen
A2: 1 | B2: Jorge Rodríguez | D2: 1 | E2: 1 | F2: 0.5 | G2: =SUM(C2:F2) -> 2.5 | H2: =C2*G$2+D2*G$3+E2*G$4+F2*G$5 -> 2.25
A3: 2 | B3: Ángel De Blas | C3: 0 | E3: 1 | F3: 0 | G3: =SUM(C3:F3) -> 1 | H3: =C3*G$2+D3*G$3+E3*G$4+F3*G$5 -> 0
A4: 3 | B4: Manuel Ramas | C4: 0 | D4: 0 | F4: 0 | G4: =SUM(C4:F4) -> 0 | H4: =C4*G$2+D4*G$3+E4*G$4+F4*G$5 -> 0
A5: 4 | B5: Javier Mazaira | C5: 0.5 | D5: 1 | E5: 1 | G5: =SUM(C5:F5) -> 2.5 | H5: =C5*G$2+D5*G$3+E5*G$4+F5*G$5 -> 2.25