A1: GRUPO 1 | C1: 1 | D1: 2 | E1: 3 | F1: 4 | G1: 5 | H1: 6 | I1: Puntos | J1: Sonnen
A2: 1 | B2: Luis Carlos Martínez | D2: 1 | E2: 1 | F2: 1 | G2: 1 | H2: 1 | I2: =SUM(C2:H2) -> 5 | J2: =C2*I$2+D2*I$3+E2*I$4+F2*I$5+G2*I$6+H2*I$7 -> 10
A3: 2 | B3: Jesús Rodríguez | C3: 0 | E3: 0.5 | F3: 1 | G3: 1 | H3: 1 | I3: =SUM(C3:H3) -> 3.5 | J3: =C3*I$2+D3*I$3+E3*I$4+F3*I$5+G3*I$6+H3*I$7 -> 4.75
A4: 3 | B4: Ernesto Pérez | C4: 0 | D4: 0.5 | F4: 1 | G4: 1 | H4: 1 | I4: =SUM(C4:H4) -> 3.5 | J4: =C4*I$2+D4*I$3+E4*I$4+F4*I$5+G4*I$6+H4*I$7 -> 4.75
A5: 4 | B5: Yago Novoa | C5: 0 | D5: 0 | E5: 0 | G5: 1 | H5: 0 | I5: =SUM(C5:H5) -> 1 | J5: =C5*I$2+D5*I$3+E5*I$4+F5*I$5+G5*I$6+H5*I$7 -> 1
A6: 5 | B6: Mario Creo | C6: 0 | D6: 0 | E6: 0 | F6: 0 | H6: 1 | I6: =SUM(C6:H6) -> 1 | J6: =C6*I$2+D6*I$3+E6*I$4+F6*I$5+G6*I$6+H6*I$7 -> 1
A7: 6 | B7: Manuel Andión | C7: 0 | D7: 0 | E7: 0 | F7: 1 | G7: 0 | I7: =SUM(C7:H7) -> 1 | J7: =C7*I$2+D7*I$3+E7*I$4+F7*I$5+G7*I$6+H7*I$7 -> 1

A1: GRUPO 2 | C1: 1 | D1: 2 | E1: 3 | F1: 4 | G1: 5 | H1: 6 | I1: Puntos | J1: Sonnen
A2: 1 | B2: Santiago Domínguez | D2: 1 | E2: 1 | F2: 0.5 | G2: 1 | H2: 1 | I2: =SUM(C2:H2) -> 4.5 | J2: =C2*I$2+D2*I$3+E2*I$4+F2*I$5+G2*I$6+H2*I$7 -> 9.5
A3: 2 | B3: Roberto Fernández | C3: 0 | E3: 1 | F3: 1 | G3: 1 | H3: 1 | I3: =SUM(C3:H3) -> 4 | J3: =C3*I$2+D3*I$3+E3*I$4+F3*I$5+G3*I$6+H3*I$7 -> 6.5
A4: 3 | B4: José Manuel Andión | C4: 0 | D4: 0 | F4: 0.5 | G4: 1 | H4: 1 | I4: =SUM(C4:H4) -> 2.5 | J4: =C4*I$2+D4*I$3+E4*I$4+F4*I$5+G4*I$6+H4*I$7 -> 3
A5: 4 | B5: José Luis Pena | C5: 0.5 | D5: 0 | E5: 0.5 | G5: 0 | H5: 1 | I5: =SUM(C5:H5) -> 2 | J5: =C5*I$2+D5*I$3+E5*I$4+F5*I$5+G5*I$6+H5*I$7 -> 3.5
A6: 5 | B6: Luciano Covelo | C6: 0 | D6: 0 | E6: 0 | F6: 1 | H6: 1 | I6: =SUM(C6:H6) -> 2 | J6: =C6*I$2+D6*I$3+E6*I$4+F6*I$5+G6*I$6+H6*I$7 -> 2
A7: 6 | B7: Víctor Fernández | C7: 0 | D7: 0 | E7: 0 | F7: 0 | G7: 0 | I7: =SUM(C7:H7) -> 0 | J7: =C7*I$2+D7*I$3+E7*I$4+F7*I$5+G7*I$6+H7*I$7 -> 0

A1: FINAL A | C1: 1 | D1: 2 | E1: 3 | F1: 4 | G1: 5 | H1: 6 | I1: Puntos | J1: Sonnen
A2: 1 | B2: Luis Carlos Martínez | D2: 1 | E2: 1 | F2: 1 | G2: 1 | H2: 1 | I2: =SUM(C2:H2) -> 5 | J2: =C2*I$2+D2*I$3+E2*I$4+F2*I$5+G2*I$6+H2*I$7 -> 10
A3: 2 | B3: Santiago Domínguez | C3: 0 | E3: 1 | F3: 1 | G3: 1 | H3: 1 | I3: =SUM(C3:H3) -> 4 | J3: =C3*I$2+D3*I$3+E3*I$4+F3*I$5+G3*I$6+H3*I$7 -> 6
A4: 3 | B4: José Manuel Andión | C4: 0 | D4: 0 | F4: 1 | G4: 0 | H4: 1 | I4: =SUM(C4:H4) -> 2 | J4: =C4*I$2+D4*I$3+E4*I$4+F4*I$5+G4*I$6+H4*I$7 -> 2
A5: 4 | B5: Ernesto Pérez | C5: 0 | D5: 0 | E5: 0 | G5: 1 | H5: 1 | I5: =SUM(C5:H5) -> 2 | J5: =C5*I$2+D5*I$3+E5*I$4+F5*I$5+G5*I$6+H5*I$7 -> 2
A6: 5 | B6: Jesús Rodríguez | C6: 0 | D6: 0 | E6: 1 | F6: 0 | H6: 1 | I6: =SUM(C6:H6) -> 2 | J6: =C6*I$2+D6*I$3+E6*I$4+F6*I$5+G6*I$6+H6*I$7 -> 2
A7: 6 | B7: Roberto Fernández | C7: 0 | D7: 0 | E7: 0 | F7: 0 | G7: 0 | I7: =SUM(C7:H7) -> 0 | J7: =C7*I$2+D7*I$3+E7*I$4+F7*I$5+G7*I$6+H7*I$7 -> 0

A1: FINAL B | C1: 1 | D1: 2 | E1: 3 | F1: 4 | G1: 5 | H1: Puntos | I1: Sonnen
A2: 1 | B2: José Luis Pena | D2: 1 | E2: 1 | F2: 1 | G2: 1 | H2: =SUM(C2:G2) -> 4 | I2: =C2*H$2+D2*H$3+E2*H$4+F2*H$5+G2*H$6 -> 6
A3: 2 | B3: Luciano Covelo | C3: 0 | E3: 1 | F3: 1 | G3: 1 | H3: =SUM(C3:G3) -> 3 | I3: =C3*H$2+D3*H$3+E3*H$4+F3*H$5+G3*H$6 -> 3
A4: 3 | B4: Yago Novoa | C4: 0 | D4: 0 | F4: 1 | G4: 1 | H4: =SUM(C4:G4) -> 2 | I4: =C4*H$2+D4*H$3+E4*H$4+F4*H$5+G4*H$6 -> 1
A5: 4 | B5: Mario Creo | C5: 0 | D5: 0 | E5: 0 | G5: 1 | H5: =SUM(C5:G5) -> 1 | I5: =C5*H$2+D5*H$3+E5*H$4+F5*H$5+G5*H$6 -> 0
A6: 5 | B6: Manuel Andión | C6: 0 | D6: 0 | E6: 0 | F6: 0 | H6: =SUM(C6:G6) -> 0 | I6: =C6*H$2+D6*H$3+E6*F$4+F6*H$5+G6*H$6 -> 0