A1: Nº | B1: EQUIPO | C1: 1 | D1: 2 | E1: 3 | F1: 4 | G1: 5 | H1: 6 | I1: 7 | J1: 8 | K1: 9 | L1: 10 | M1: 11 | N1: 12 | O1: Puntos | P1: Sonnen
A2: 1 | B2: Círculo Ferrolano B | D2: 0.5 | E2: 3 | F2: 3 | G2: 3 | H2: 4 | I2: 2 | J2: 4 | K2: 3 | L2: 3 | M2: 3.5 | N2: 3 | O2: =SUM(C2:R2) -> 32 | P2: 644.5
A3: 2 | B3: Ciudad Jardín | C3: 3.5 | E3: 0.5 | F3: 1.5 | G3: 4 | H3: 4 | I3: 3 | J3: 2 | K3: 3 | L3: 2.5 | M3: 4 | N3: 4 | O3: =SUM(C3:R3) -> 32 | P3: 641.5
A4: 3 | B4: Ajedrez Arteixo "A" | C4: 1 | D4: 3.5 | F4: 3 | G4: 3 | H4: 2.5 | I4: 3 | J4: 2.5 | K4: 3.5 | L4: 4 | M4: 3 | N4: 2 | O4: =SUM(C4:R4) -> 31 | P4: 644.5
A5: 4 | B5: Ajedrez As Pontes | C5: 1 | D5: 2.5 | E5: 1 | G5: 0.5 | H5: 1 | I5: 1.5 | J5: 3 | K5: 2.5 | L5: 3.5 | M5: 3.5 | N5: 3 | O5: =SUM(C5:R5) -> 23 | P5: 460.25
A6: 5 | B6: A Sardiñeira "A" | C6: 1 | D6: 0 | E6: 1 | F6: 3.5 | H6: 2.5 | I6: 1.5 | J6: 2 | K6: 3 | L6: 3.5 | M6: 1.5 | N6: 2 | O6: =SUM(C6:R6) -> 21.5 | P6: 429.5
A7: 6 | B7: Sagrada Familia "B" | C7: 0 | D7: 0 | E7: 1.5 | F7: 3 | G7: 1.5 | I7: 2 | J7: 2.5 | K7: 2.5 | L7: 2.5 | M7: 3 | N7: 3 | O7: =SUM(C7:R7) -> 21.5 | P7: 408.5
A8: 7 | B8: Peña Ex-Alcohólicos | C8: 2 | D8: 1 | E8: 1 | F8: 2.5 | G8: 2.5 | H8: 2 | J8: 3 | K8: 1 | L8: 1 | M8: 2.5 | N8: 2 | O8: =SUM(C8:R8) -> 20.5 | P8: 438.25
A9: 8 | B9: Ajedrez Artesanos | C9: 0 | D9: 2 | E9: 1.5 | F9: 1 | G9: 2 | H9: 1.5 | I9: 1 | K9: 2.5 | L9: 2.5 | M9: 2.5 | N9: 3.5 | O9: =SUM(C9:R9) -> 20 | P9: 397.5
A10: 9 | B10: Dominicos "A" | C10: 1 | D10: 1 | E10: 0.5 | F10: 1.5 | G10: 1 | H10: 1.5 | I10: 3 | J10: 1.5 | L10: 3 | M10: 1 | N10: 3.5 | O10: =SUM(C10:R10) -> 18.5 | P10: 367.25
A11: 10 | B11: Ajedrez Grupo Bazán | C11: 1 | D11: 1.5 | E11: 0 | F11: 0.5 | G11: 0.5 | H11: 1.5 | I11: 3 | J11: 1.5 | K11: 1 | M11: 3.5 | N11: 3 | O11: =SUM(C11:R11) -> 17 | P11: 333
A12: 11 | B12: Ajedrez Canido "B" | C12: 0.5 | D12: 0 | E12: 1 | F12: 0.5 | G12: 2.5 | H12: 1 | I12: 1.5 | J12: 1.5 | K12: 3 | L12: 0.5 | N12: 3 | O12: =SUM(C12:R12) -> 15 | P12: 294.5
A13: 12 | B13: Tabla de Flandes | C13: 1 | D13: 0 | E13: 2 | F13: 1 | G13: 2 | H13: 1 | I13: 2 | J13: 0.5 | K13: 0.5 | L13: 1 | M13: 1 | O13: =SUM(C13:R13) -> 12 | P13: 273.75

A1: Promoción 2ª A - 3ª G
A2: IDA 01/06/2002 | B2: ALFIL "A" | C2: 0,5 - 3,5 | D2: DOMINICOS "A"
A3: VUELTA 08/06/2002 | B3: DOMINICOS "A" | C3: 2 - 2 | D3: ALFIL "A"

A1: Nº | B1: JUGADOR | C1: 1 | D1: 2 | E1: 3 | F1: 4 | G1: 5 | H1: 6 | I1: 7 | J1: Puntos | K1: Sonnen
A2: 1 | B2: C.I.D.U. | D2: 2 | E2: 4 | F2: 3.5 | G2: 3 | H2: 4 | I2: 4 | J2: =SUM(C2:I2) -> 20.5 | K2: =C2*J$2+D2*J$3+E2*J$4+F2*J$5+G2*J$6+H2*J$7+I2*J$8 -> 203.75
A3: 2 | B3: SIGRÁS B | C3: 2 | E3: 2.5 | F3: 3 | G3: 2.5 | H3: 3.5 | I3: 4 | J3: =SUM(C3:I3) -> 17.5 | K3: =C3*J$2+D3*J$3+E3*J$4+F3*J$5+G3*J$6+H3*J$7+I3*J$8 -> 176.5
A4: 3 | B4: DOMINICOS B | C4: 0 | D4: 1.5 | F4: 1.5 | G4: 4 | H4: 3 | I4: 2.5 | J4: =SUM(C4:I4) -> 12.5 | K4: =C4*J$2+D4*J$3+E4*J$4+F4*J$5+G4*J$6+H4*J$7+I4*J$8 -> 114.75
A5: 4 | B5: SANTO DOMINGO | C5: 0.5 | D5: 1 | E5: 2.5 | G5: 2 | H5: 2.5 | I5: 4 | J5: =SUM(C5:I5) -> 12.5 | K5: =C5*J$2+D5*J$3+E5*J$4+F5*J$5+G5*J$6+H5*J$7+I5*J$8 -> 113.75
A6: 5 | B6: ALEX. BÓVEDA C | C6: 1 | D6: 1.5 | E6: 0 | F6: 2 | H6: 1 | I6: 3.5 | J6: =SUM(C6:I6) -> 9 | K6: =C6*J$2+D6*J$3+E6*J$4+F6*J$5+G6*J$6+H6*J$7+I6*J$8 -> 95
A7: 6 | B7: CERCEDA JUNIOR | C7: 0 | D7: 0.5 | E7: 1 | F7: 1.5 | G7: 3 | I7: 1.5 | J7: =SUM(C7:I7) -> 7.5 | K7: =C7*J$2+D7*J$3+E7*J$4+F7*J$5+G7*J$6+H7*J$7+I7*J$8 -> 73.75
A8: 7 | B8: PALAESTRA-MARISTAS | C8: 0 | D8: 0 | E8: 1.5 | F8: 0 | G8: 0.5 | H8: 2.5 | J8: =SUM(C8:I8) -> 4.5 | K8: =C8*J$2+D8*J$3+E8*J$4+F8*J$5+G8*J$6+H8*J$7+I8*J$8 -> 42

A1: IDA 01/06/2002 | B1: C.I.D.U. | C1: 1,5 - 2,5 | D1: MERCANTIL "B"
A2: VUELTA 08/06/2002 | B2: MERCANTIL "B" | C2: 4 - 0 | D2: C.I.D.U.