A1: Nº | B1: Jugador | C1: 1 | D1: 2 | E1: 3 | F1: 4 | G1: 5 | H1: 6 | I1: 7 | J1: 8 | K1: Puntos | L1: Sonnen
A2: 1 | B2: Jesús Rodríguez | D2: 0.5 | E2: 1 | F2: 1 | G2: 0.5 | H2: 1 | I2: 1 | J2: 1 | K2: =SUM(C2:J2) -> 6 | L2: =C2*K$2+D2*K$3+E2*K$4+F2*K$5+G2*K$6+H2*K$7+I2*K$8+J2*K$9 -> 17.5
A3: 2 | B3: Ernesto Pérez | C3: 0.5 | E3: 0 | F3: 1 | G3: 1 | H3: 1 | I3: 1 | J3: 1 | K3: =SUM(C3:J3) -> 5.5 | L3: =C3*K$2+D3*K$3+E3*K$4+F3*K$5+G3*K$6+H3*K$7+I3*K$8+J3*K$9 -> 15.5
A4: 3 | B4: José Manuel Andión | C4: 0 | D4: 1 | F4: 0 | G4: 1 | H4: 0 | I4: 1 | J4: 1 | K4: =SUM(C4:J4) -> 4 | L4: =C4*K$2+D4*K$3+E4*K$4+F4*K$5+G4*K$6+H4*K$7+I4*K$8+J4*K$9 -> 11
A5: 4 | B5: Luis Patiño | C5: 0 | D5: 0 | E5: 1 | G5: 1 | H5: 1 | I5: 0 | J5: 1 | K5: =SUM(C5:J5) -> 4 | L5: =C5*K$2+D5*K$3+E5*K$4+F5*K$5+G5*K$6+H5*K$7+I5*K$8+J5*K$9 -> 10.5
A6: 5 | B6: Juan Bouzas | C6: 0.5 | D6: 0 | E6: 0 | F6: 0 | H6: 1 | I6: 1 | J6: 1 | K6: =SUM(C6:J6) -> 3.5 | L6: =C6*K$2+D6*K$3+E6*K$4+F6*K$5+G6*K$6+H6*K$7+I6*K$8+J6*K$9 -> 8
A7: 6 | B7: Francisco Conde | C7: 0 | D7: 0 | E7: 1 | F7: 0 | G7: 0 | I7: 1 | J7: 1 | K7: =SUM(C7:J7) -> 3 | L7: =C7*K$2+D7*K$3+E7*K$4+F7*K$5+G7*K$6+H7*K$7+I7*K$8+J7*K$9 -> 6
A8: 7 | B8: Héctor López | C8: 0 | D8: 0 | E8: 0 | F8: 1 | G8: 0 | H8: 0 | J8: 1 | K8: =SUM(C8:J8) -> 2 | L8: =C8*K$2+D8*K$3+E8*K$4+F8*K$5+G8*K$6+H8*K$7+I8*K$8+J8*K$9 -> 4
A9: 8 | B9: Manuel Andión | C9: 0 | D9: 0 | E9: 0 | F9: 0 | G9: 0 | H9: 0 | I9: 0 | K9: =SUM(C9:J9) -> 0 | L9: =C9*K$2+D9*K$3+E9*K$4+F9*K$5+G9*K$6+H9*K$7+I9*K$8+J9*K$9 -> 0