A1: Nº | B1: Jugador | C1: 1 | D1: 2 | E1: 3 | F1: 4 | G1: 5 | H1: 6 | I1: Puntos | J1: Sonnen
A2: 1 | B2: Javier Mazaira | D2: 0 | E2: 1 | F2: 1 | G2: 1 | H2: 1 | I2: =SUM(C2:H2) -> 4 | J2: =C2*I$2+D2*I$3+E2*I$4+F2*I$5+G2*I$6+H2*I$7 -> 7.5
A3: 2 | B3: Marcos Martínez | C3: 1 | E3: 0.5 | F3: 0 | G3: 1 | H3: 1 | I3: =SUM(C3:H3) -> 3.5 | J3: =C3*I$2+D3*I$3+E3*I$4+F3*I$5+G3*I$6+H3*I$7 -> 8.25
A4: 3 | B4: Guillermo Ambroa | C4: 0.5 | D4: 0.5 | F4: 0 | G4: 1 | H4: 1 | I4: =SUM(C4:H4) -> 2.5 | J4: =C4*I$2+D4*I$3+E4*I$4+F4*I$5+G4*I$6+H4*I$7 -> 4.75
A5: 4 | B5: Héctor López | C5: 0 | D5: 1 | E5: 1 | G5: 0 | H5: 0 | I5: =SUM(C5:H5) -> 2 | J5: =C5*I$2+D5*I$3+E5*I$4+F5*I$5+G5*I$6+H5*I$7 -> 6
A6: 5 | B6: Luis Patiño | C6: 0 | D6: 0 | E6: 0 | F6: 1 | H6: 1 | I6: =SUM(C6:H6) -> 2 | J6: =C6*I$2+D6*I$3+E6*I$4+F6*I$5+G6*I$6+H6*I$7 -> 3
A7: 6 | B7: Juan Bouzas | C7: 0 | D7: 0 | E7: 0 | F7: 1 | G7: 0 | I7: =SUM(C7:H7) -> 1 | J7: =C7*I$2+D7*I$3+E7*I$4+F7*I$5+G7*I$6+H7*I$7 -> 2