0: Puesto | 0: Jugador | A0: =SUM(B1:I1) -> Puntos | B0: =SUM(B1:I1) -> Sonnen
1: 1º | 1: Javier Mazaira | A1: =SUM(B1:I1) -> 24.5 | B1: =SUM(B1:I1) -> 
2: 2º | 2: Santiago Domínguez | A2: =SUM(B2:I2) -> 20.5 | B2: =SUM(B2:I2) -> 20.5
3: 3º | 3: Luis CarlosMartínez | A3: =SUM(B3:I3) -> 18.5 | B3: =SUM(B3:I3) -> 18.5
4: 4º | 4: Ernesto Pérez | A4: =SUM(B4:I4) -> 13.5 | B4: =SUM(B4:I4) -> 13.5
5: 5º | 5: Juan Bouzas | A5: =SUM(B5:I5) -> 14.5 | B5: =SUM(B5:I5) -> 14.5
6: 6º | 6: Guillermo Ambroa | A6: =SUM(B6:I6) -> 12.5 | B6: =SUM(B6:I6) -> 12.5
7: 7º | 7: Jesús Rodríguez | A7: =SUM(B7:I7) -> 9 | B7: =SUM(B7:I7) -> 112
8: 8º | 8: Héctor López | A8: =SUM(B8:I8) -> 9 | B8: =SUM(B8:I8) -> 110.5

A1: 1ª ronda | B1: 2ª ronda
A2: 3ª ronda | B2: 4ª ronda

A1: Nº | B1: XOGADOR | C1: 1 | E1: 2 | G1: 3 | I1: 4 | K1: 5 | M1: 6 | O1: 7 | Q1: 8
A2: 1 | B2: Héctor López | E2: 1 | F2: 0 | G2: 0 | H2: 0 | I2: 0 | J2: 0 | K2: 0 | L2: 0 | M2: 1 | N2: 0 | O2: 1 | P2: 0 | Q2: 1 | R2: 0
E3: 0 | F3: 1 | G3: 0 | H3: 0 | I3: 0 | J3: 1 | K3: 0 | L3: 1 | M3: 0 | N3: 0 | O3: 0 | P3: 0 | Q3: 1 | R3: 1
A4: 2 | B4: Ernesto Pérez | C4: 0 | D4: 1 | G4: 0 | H4: 0 | I4: 0 | J4: 1 | K4: 1 | L4: 1 | M4: 0 | N4: 1 | O4: 0 | P4: 0 | Q4: 1 | R4: 1
C5: 1 | D5: 0 | G5: 1 | H5: ½ | I5: 0 | J5: 0 | K5: 1 | L5: 1 | M5: ½ | N5: 1 | O5: 0 | P5: 0 | Q5: 1 | R5: 0
A6: 3 | B6: Javier Mazaira | C6: 1 | D6: 1 | E6: 1 | F6: 1 | I6: 1 | J6: 1 | K6: 1 | L6: 1 | M6: 1 | N6: 1 | O6: 1 | P6: 0 | Q6: 1 | R6: 1
C7: 1 | D7: 1 | E7: 0 | F7: ½ | I7: 1 | J7: 0 | K7: 1 | L7: 1 | M7: 1 | N7: 1 | O7: 1 | P7: 1 | Q7: 1 | R7: 1
A8: 4 | B8: Santiago Domínguez | C8: 1 | D8: 1 | E8: 1 | F8: 0 | G8: 0 | H8: 0 | K8: 0 | L8: 1 | M8: 1 | N8: 1 | O8: 1 | P8: 1 | Q8: 1 | R8: 1
C9: 1 | D9: 0 | E9: 1 | F9: 1 | G9: 0 | H9: 1 | K9: 1 | L9: 0 | M9: 1 | N9: 0 | O9: ½ | P9: 1 | Q9: 1 | R9: 0
A10: 5 | B10: Guillermo Ambroa | C10: 1 | D10: 1 | E10: 0 | F10: 0 | G10: 0 | H10: 0 | I10: 1 | J10: 0 | M10: 1 | N10: 1 | O10: 1 | P10: 0 | Q10: 0 | R10: 0
C11: 1 | D11: - | E11: 0 | F11: - | G11: 0 | H11: - | I11: 0 | J11: 1 | M11: 0 | N11: 1 | O11: 0 | P11: - | Q11: 1 | R11: 0
A12: 6 | B12: Juan Bouzas | C12: 0 | D12: 1 | E12: 1 | F12: 0 | G12: 0 | H12: 0 | I12: 0 | J12: 0 | K12: 0 | L12: 0 | O12: 0 | P12: 1 | Q12: 1 | R12: ½
C13: 1 | D13: 1 | E13: ½ | G13: 0 | H13: 0 | I13: 0 | J13: 1 | K13: 1 | L13: 0 | O13: 1 | P13: 0 | Q13: 0 | R13: 1
A14: 7 | B14: Luis Carlos Martínez | C14: 0 | D14: 1 | E14: 1 | F14: 01 | G14: 0 | H14: 1 | I14: 0 | J14: 0 | K14: 0 | L14: 1 | M14: 1 | N14: 0 | Q14: 1 | R14: ½
C15: 1 | D15: 1 | E15: 1 | F15: 1 | G15: 0 | H15: 0 | I15: ½ | J15: 0 | K15: 1 | L15: 1 | M15: 0 | N15: 1 | Q15: 1 | R15: 0
A16: 8 | B16: Jesús Rodríguez | C16: 0 | D16: 1 | E16: 0 | F16: 0 | G16: 0 | H16: 0 | I16: 0 | J16: 0 | K16: 1 | L16: 1 | M16: 0 | N16: ½ | O16: 0 | P16: ½
C17: 0 | D17: 0 | E17: 0 | F17: 1 | G17: 0 | H17: 0 | I17: 0 | J17: 1 | K17: 0 | L17: 1 | M17: 1 | N17: 0 | O17: 0 | P17: 1