A1: CIRCUITOS DE AGAX 2002-2003 /// PRIMEROS CLASIFICADOS

A0: COPA BRIGANTIUM | B0: TX | C0: CB | D0: % | E0: ag-rap02 | F0: ag-sem02 | G0: do-vro02 | H0: pa-fis02 | I0: pa-abs02 | J0: un-out02 | K0: ag-nad02 | L0: ag-ani02 | M0: cd-mar02 | N0: ag-dam03 | O0: ag-tdv03 | P0: sd-tsd03 | Q0: ag-rap03
A1: Andión, José Manuel | B1: 5 | C1: 102 | D1: =C2/B2 -> 23.666666666666668 | E1: 33 | H1: 13 | N1: 25 | P1: 17 | Q1: 20
A2: Andión, Manuel | B2: 3 | C2: 38 | D2: =C3/B3 -> 13 | E2: 13 | H2: 11 | P2: 14
A3: Bouzas, Juan | B3: 3 | C3: 20 | D3: =C4/B4 -> 6.666666666666667 | E3: 20 | F3: -17 | H3: 17
A4: Conde, Francisco | B4: 2 | C4: 37 | D4: =C5/B5 -> 18.5 | E4: 17 | H4: 20
A5: Domínguez, Santiago | B5: 11 | C5: 611 | D5: =C6/B6 -> 53.111111111111114 | F5: 20 | G5: 33 | H5: 33 | I5: 33 | J5: 50 | L5: 100 | M5: 9 | N5: 100 | O5: 100 | P5: 100 | Q5: 33
A6: González, Florencio | B6: 1 | C6: 20 | D6: =C7/B7 -> 20 | L6: 20
A7: Iglesias, Alfonso | B7: 1 | C7: 33 | D7: =C8/B8 -> 34.666666666666664 | P7: 33
A8: López, Héctor | B8: 7 | C8: 228 | D8: =C8/B8 -> 34.666666666666664 | E8: 14 | F8: 100 | H8: 14 | J8: 14 | L8: 33 | O8: 33 | P8: 20
A9: Martínez, Luis Carlos | B9: 3 | C9: 250 | D9: =C9/B9 -> 83 | G9: 100 | P9: 50 | Q9: 100
A10: Mazaira, Javier | B10: 5 | C10: 269 | D10: =C10/B10 -> 53.8 | H10: 100 | I10: 100 | J10: 33 | K10: 11 | M10: 25
A11: Mouriño, David | B11: 1 | C11: 6 | D11: =C11/B11 -> 6 | M11: 6
A12: Patiño, Luis | B12: 7 | C12: 242 | D12: =C12/B12 -> 35 | E12: 25 | F12: 50 | G12: 50 | I12: 14 | J12: 20 | N12: 33 | Q12: 50
A13: Pena, José Luis | B13: 2 | C13: 57 | D13: =C13/B13 -> 28.5 | L13: 50 | M13: 7
A14: Pérez, Ernesto | B14: 11 | C14: 344 | D14: =C14/B14 -> 31.9 | E14: 50 | F14: 25 | G14: 25 | H14: 50 | I14: 13 | J14: 17 | K14: 14 | L14: 25 | N14: 50 | O14: 50 | Q14: 25
A15: Rodríguez, Jesús | B15: 7 | C15: 225 | D15: =C15/B15 -> 36.6 | E15: 100 | F15: 33 | I15: 20 | J15: 13 | O15: 17 | P15: 25 | Q15: 17

A1: TEMÁTICO RÁPIDAS BÁSICO | B1: TX | C1: CR | D1: % | E1: Bird | F1: Esla | G1: Buda | H1: Hola | I1: Esca | J1: Pirc | K1: Alek | L1: Cata | M1: Inda | N1: Vien | O1: Evan | P1: 2cab
A2: Andión, José Manuel | B2: =COUNT(E2:P2) -> 9 | C2: =SUM(E2:P2) -> 264 | D2: =C2/B2 -> 29.333333333333332 | E2: 33 | F2: 20 | G2: 50 | H2: 33 | K2: 25 | L2: 25 | M2: 20 | N2: 25 | P2: 33
A3: Andión, Manuel | B3: =COUNT(E3:P3) -> 6 | C3: =SUM(E3:P3) -> 109 | D3: =C3/B3 -> 18.166666666666668 | E3: 13 | F3: 14 | G3: 25 | L3: 20 | M3: 17 | N3: 20
A4: Bouzas, Juan | B4: =COUNT(E4:P4) -> 1 | C4: =SUM(E4:P4) -> 33 | D4: =C4/B4 -> 33 | F4: 33
A5: Conde, Francisco | B5: =COUNT(E5:P5) -> 1 | C5: =SUM(E5:P5) -> 25 | D5: =C5/B5 -> 25 | E5: 25
A6: Domínguez, Santiago | B6: =COUNT(E6:P6) -> 10 | C6: =SUM(E6:P6) -> 556 | D6: =C6/B6 -> 55.6 | E6: 20 | F6: 17 | G6: 100 | H6: 100 | I6: 50 | J6: 36 | K6: 50 | L6: 100 | O6: 33 | P6: 50
A7: Fernández, Víctor | B7: =COUNT(E7:P7) -> 1 | C7: =SUM(E7:P7) -> 50 | D7: =C7/B7 -> 50 | M7: 50
A8: López, Héctor | B8: =COUNT(E8:P8) -> 2 | C8: =SUM(E8:P8) -> 133 | D8: =C8/B8 -> 66.5 | I8: 33 | M8: 100
A9: Martínez, Luis Carlos | B9: =COUNT(E9:P9) -> 7 | C9: =SUM(E9:P9) -> 525 | D9: =C9/B9 -> 75 | F9: 25 | H9: 50 | J9: 100 | K9: 100 | L9: 50 | O9: 100 | P9: 100
A10: Mazaira, Javier | B10: =COUNT(E10:P10) -> 2 | C10: =SUM(E10:P10) -> 150 | D10: =C10/B10 -> 75 | E10: 100 | O10: 50
A11: Patiño, Luis | B11: =COUNT(E11:P11) -> 1 | C11: =SUM(E11:P11) -> 14 | D11: =C11/B11 -> 14 | E11: 14
A12: Pena, José Luis | B12: =COUNT(E12:P12) -> 1 | C12: =SUM(E12:P12) -> 36 | D12: =C12/B12 -> 36 | J12: 36
A13: Pérez, Ernesto | B13: =COUNT(E13:P13) -> 12 | C13: =SUM(E13:P13) -> 552 | D13: =C13/B13 -> 46 | E13: 17 | F13: 100 | G13: 33 | H13: 25 | I13: 100 | J13: 36 | K13: 33 | L13: 33 | M13: 25 | N13: 100 | O13: 25 | P13: 25
A14: Rodríguez, Jesús | B14: =COUNT(E14:P14) -> 4 | C14: =SUM(E14:P14) -> 183 | D14: =C14/B14 -> 45.75 | E14: 50 | F14: 50 | M14: 33 | N14: 50

A1: TEMÁTICO RÁPIDAS SICILIANA | B1: TX | C1: CR | D1: % | E1: Sche | F1: Najd | G1: Peli | H1: Drag | I1: Ross | J1: Alap
A2: Andión, José Manuel | B2: =COUNT(E2:J2) -> 5 | C2: =SUM(E2:J2) -> 225 | D2: =C2/B2 -> 45 | E2: 17 | F2: 100 | G2: 50 | H2: 25 | J2: 33
A3: Andión, Manuel | B3: =COUNT(E3:J3) -> 2 | C3: =SUM(E3:J3) -> 40 | D3: =C3/B3 -> 20 | G3: 20 | H3: 20
A4: Bouzas, Juan | B4: =COUNT(E4:J4) -> 2 | C4: =SUM(E4:J4) -> 55 | D4: =C4/B4 -> 27.5 | E4: 14 | H4: 41
A5: Domínguez, Santiago | B5: =COUNT(E5:J5) -> 4 | C5: =SUM(E5:J5) -> 350 | D5: =C5/B5 -> 87.5 | E5: 100 | F5: 50 | G5: 100 | H5: 100
A6: Martínez, Luis Carlos | B6: =COUNT(E6:J6) -> 2 | C6: =SUM(E6:J6) -> 133 | D6: =C6/B6 -> 66.5 | E6: 33 | J6: 100
A7: Patiño, Luis | B7: =COUNT(E7:J7) -> 1 | C7: =SUM(E7:J7) -> 33 | D7: =C7/B7 -> 33 | I7: 33
A8: Mazaira, Javier | B8: =COUNT(E8:J8) -> 1 | C8: =SUM(E8:J8) -> 20 | D8: =C8/B8 -> 20 | E8: 20
A9: Pena, José Luis | B9: =COUNT(E9:J9) -> 2 | C9: =SUM(E9:J9) -> 120 | D9: =C9/B9 -> 60 | G9: 20 | I9: 100
A10: Pérez, Ernesto | B10: =COUNT(E10:J10) -> 6 | C10: =SUM(E10:J10) -> 232 | D10: =C10/B10 -> 38.666666666666664 | E10: 25 | F10: 33 | G10: 33 | H10: 41 | I10: 50 | J10: 50
A11: Rodríguez, Jesús | B11: =COUNT(E11:J11) -> 1 | C11: =SUM(E11:J11) -> 50 | D11: =C11/B11 -> 50 | E11: 50

A1: PROBLEMAS | B1: TX | C1: PR | D1: % | E1: 37519 | F1: 37575 | G1: 37750 | H1: 37845 | I1: 37846 | J1: 37847
A2: Andión, José Manuel | B2: 4 | C2: 192 | D2: =C2/B2 -> 48 | E2: 17 | F2: 100 | I2: 25 | J2: 50
A3: Andión, Manuel | B3: 4 | C3: 158 | D3: =C3/B3 -> 39.5 | E3: 50 | F3: 50 | I3: 33 | J3: 25
A4: Bouzas, Juan | B4: 2 | C4: 50 | D4: =C4/B4 -> 25 | E4: 25 | H4: 25
A5: Domínguez, Santiago | B5: 6 | C5: 416 | D5: =C5/B5 -> 69.333333333333329 | E5: 33 | F5: 33 | G5: 100 | H5: 100 | I5: 50 | J5: 100
A6: Mazaira, Javier | B6: 1 | C6: 100 | D6: =C6/B6 -> 100 | E6: 100
A7: Martínez, Luis Carlos | B7: 3 | C7: 166 | D7: =C7/B7 -> 55.333333333333336 | H7: 33 | I7: 100 | J7: 33
A8: Rodríguez, Jesús | B8: 2 | C8: 70 | D8: =C8/B8 -> 35 | E8: 20 | H8: 50

A1: TEMÁTICO INDIA DE REY | B1: TX | C1: CR | D1: % | E1: At4p | F1: Fian | G1: Aver | H1: Clas | I1: Jaen | J1: Bole
A2: Andión, José Manuel | B2: =COUNT(E2:J2) -> 6 | C2: =SUM(E2:J2) -> 257 | D2: =C2/B2 -> 42.833333333333336 | E2: 20 | F2: 20 | G2: 100 | H2: 17 | I2: 50 | J2: 50
A3: Andión, Manuel | B3: =COUNT(E3:J3) -> 3 | C3: =SUM(E3:J3) -> 53 | D3: =C3/B3 -> 17.666666666666668 | E3: 25 | F3: 14 | H3: 14
A4: Bouzas, Juan | B4: =COUNT(E4:J4) -> 2 | C4: =SUM(E4:J4) -> 42 | D4: =C4/B4 -> 21 | E4: 17 | F4: 25
A5: Iglesias, Alfonso | B5: =COUNT(E5:J5) -> 1 | C5: =SUM(E5:J5) -> 50 | D5: =C5/B5 -> 50 | H5: 50
A6: Domínguez, Santiago | B6: =COUNT(E6:J6) -> 4 | C6: =SUM(E6:J6) -> 208 | D6: =C6/B6 -> 52 | E6: 50 | F6: 100 | H6: 33 | I6: 25
A7: López, Héctor | B7: =COUNT(E7:J7) -> 1 | C7: =SUM(E7:J7) -> 33 | D7: =C7/B7 -> 33 | E7: 33
A8: Mazaita, Javier | B8: =COUNT(E8:J8) -> 1 | C8: =SUM(E8:J8) -> 100 | D8: =C8/B8 -> 100 | I8: 100
A9: Patiño, Luis | B9: =COUNT(E9:J9) -> 1 | C9: =SUM(E9:J9) -> 20 | D9: =C9/B9 -> 20 | H9: 20
A10: Martínez, Luis Carlos | B10: =COUNT(E10:J10) -> 2 | C10: =SUM(E10:J10) -> 117 | D10: =C10/B10 -> 58.5 | F10: 17 | H10: 100
A11: Pena, José Luis | B11: =COUNT(E11:J11) -> 1 | C11: =SUM(E11:J11) -> 50 | D11: =C11/B11 -> 50 | F11: 50
A12: Pérez, Ernesto | B12: =COUNT(E12:J12) -> 6 | C12: =SUM(E12:J12) -> 324 | D12: =C12/B12 -> 54 | E12: 100 | F12: 33 | G12: 33 | H12: 25 | I12: 33 | J12: 100
A13: Rodríguez, Jesús | B13: =COUNT(E13:J13) -> 2 | C13: =SUM(E13:J13) -> 83 | D13: =C13/B13 -> 41.5 | G13: 50 | J13: 33