A1: 1º LUIS CARLOS MARTÍNEZ | B1: 583 | C1: 73
A2: 2º FRANCISCO CONDE | B2: 549 | C2: 46
A3: 3º ERNESTO PÉREZ | B3: 528 | C3: 44
A4: 4º SANTIAGO DOMÍNGUEZ

A1: NOME | B1: TX | C1: CR | D1: % | E1: Españ | F1: Itali | G1: Escoc | H1: G.Rey | I1: Rusa | J1: Sicil | K1: Franc | L1: CaroK | M1: Ingls | N1: G.Dam | O1: Nimzo | P1: IndiaR
A2: Alonso, Justo | B2: =COUNT(E2:P2) -> 2 | C2: =SUM(E2:P2) -> 70 | D2: =C2/B2 -> 35 | E2: 50 | K2: 20
A3: Andión, José Manuel | B3: =COUNT(E3:P3) -> 10 | C3: =SUM(E3:P3) -> 210 | D3: =C3/B3 -> 21 | E3: 25 | F3: 14 | H3: 14 | I3: 33 | J3: 20 | K3: 17 | L3: 17 | M3: 17 | N3: 20 | P3: 33
A4: Andión, Manuel | B4: =COUNT(E4:P4) -> 7 | C4: =SUM(E4:P4) -> 105 | D4: =C4/B4 -> 15 | F4: 13 | I4: 13 | J4: 17 | K4: 14 | L4: 20 | M4: 14 | P4: 14
A5: Bouzas, Juan Manuel | B5: =COUNT(E5:P5) -> 1 | C5: =SUM(E5:P5) -> 50 | D5: =C5/B5 -> 50 | P5: 50
A6: Conde, Francisco | B6: =COUNT(E6:P6) -> 12 | C6: =SUM(E6:P6) -> 549 | D6: =C6/B6 -> 45.75 | E6: 13 | F6: 100 | G6: 50 | H6: 33 | I6: 25 | J6: 100 | K6: 25 | L6: 33 | M6: 50 | N6: 50 | O6: 50 | P6: 20
A7: Domínguez, Santiago | B7: =COUNT(E7:P7) -> 11 | C7: =SUM(E7:P7) -> 366 | D7: =C7/B7 -> 33.272727272727273 | E7: 33 | F7: 33 | G7: 20 | H7: 17 | I7: 14 | J7: 25 | K7: 33 | L7: 25 | M7: 33 | N7: 33 | O7: 100
A8: González, Florencio | B8: =COUNT(E8:P8) -> 0 | C8: =SUM(E8:P8) -> 0
A9: Iglesias, Alfonso | B9: =COUNT(E9:P9) -> 0 | C9: =SUM(E9:P9) -> 0
A10: López, Héctor | B10: =COUNT(E10:P10) -> 3 | C10: =SUM(E10:P10) -> 54 | D10: =C10/B10 -> 18 | F10: 17 | O10: 20 | P10: 17
A11: Martínez, Luis Carlos | B11: =COUNT(E11:P11) -> 8 | C11: =SUM(E11:P11) -> 583 | D11: =C11/B11 -> 72.875 | E11: 100 | F11: 50 | G11: 100 | H11: 100 | I11: 100 | K11: 50 | L11: 50 | O11: 33
A12: Mazaira, Javier | B12: =COUNT(E12:P12) -> 6 | C12: =SUM(E12:P12) -> 300 | D12: =C12/B12 -> 50 | G12: 25 | H12: 50 | I12: 50 | J12: 50 | M12: 25 | P12: 100
A13: Mouriño, David | B13: =COUNT(E13:P13) -> 2 | C13: =SUM(E13:P13) -> 33 | D13: =C13/B13 -> 16.5 | H13: 13 | I13: 20
A14: Muiños, Iago | B14: =COUNT(E14:P14) -> 1 | C14: =SUM(E14:P14) -> 20 | D14: =C14/B14 -> 20 | F14: 20
A15: Patiño, Luis | B15: =COUNT(E15:P15) -> 0 | C15: =SUM(E15:P15) -> 0
A16: Pena, José Luis | B16: =COUNT(E16:P16) -> 4 | C16: =SUM(E16:P16) -> 157 | D16: =C16/B16 -> 39.25 | E16: 17 | H16: 20 | M16: 20 | N16: 100
A17: Pérez, Ernesto | B17: =COUNT(E17:P17) -> 12 | C17: =SUM(E17:P17) -> 528 | D17: =C17/B17 -> 44 | E17: 20 | F17: 25 | G17: 33 | H17: 25 | I17: 17 | J17: 33 | K17: 100 | L17: 100 | M17: 100 | N17: 25 | O17: 25 | P17: 25