A1: COPA BRIGANTIUM
A2: 1º Ernesto Pérez 784 | B2: 2º Santiago Domínguez 398 | C2: 3º Héctor López 348
A3: CIRCUITO DE RÁPIDAS
A4: 1º Santiago Domínguez 494 | B4: 2º Ernesto Pérez 423 | C4: 3º José Manuel Andión 337

A1: COPA BRIGANTIUM | B1: TX | C1: CB | D1: % | E1: do-vro03 | F1: do-vrr03 | G1: pa-fis03 | H1: ag-sem03 | I1: un-out03 | J1: ag-rap03 | K1: ag-nad03 | L1: ag-ani03 | M1: cd-mar03 | N1: cd-rcc03 | O1: ag-dam03 | P1: sd-tsd04 | Q1: ag-tdv00 | R1: ag-gra
A2: Andión, José Manuel | B2: 2 | C2: 69 | D2: =C2/B2 -> 35 | K2: 33 | Q2: 36
A3: Andión, Manuel | B3: 1 | C3: 11 | D3: =C3/B3 -> 11 | K3: 11
A4: Conde, Francisco | B4: 4 | C4: 133 | D4: =C4/B4 -> 33.25 | F4: 50 | K4: 25 | N4: 25 | O4: 33
A5: Domínguez, Santiago | B5: 7 | C5: 398 | D5: =C5/B5 -> 49.666666666666664 | E5: 100 | F5: 25 | H5: 20 | I5: 33 | K5: 20 | L5: 100 | Q5: 100
A6: González, Florencio | B6: 2 | C6: 40 | D6: =C6/B6 -> 20 | L6: 20 | M6: 20
A7: Iglesias, Alfonso | B7: 2 | C7: 45 | D7: =C7/B7 -> 23 | K7: 9 | Q7: 36
A8: López, Héctor | B8: 11 | C8: 348 | D8: =C8/B8 -> 31.333333333333332 | E8: 20 | F8: 20 | G8: 50 | H8: 25 | J8: 33 | K8: 50 | L8: 25 | M8: 9 | O8: 50 | P8: 33 | R8: 33
A9: Martínez, Luis Carlos | B9: 4 | C9: 250 | D9: =C9/B9 -> 62.5 | E9: 50 | H9: 100 | I9: 50 | N9: 50
A10: Patiño, Luis | B10: 6 | C10: 283 | D10: =C10/B10 -> 47.166666666666664 | E10: 33 | F10: 33 | H10: 50 | J10: 50 | K10: 17 | N10: 100
A11: Pena, José Luis | B11: 3 | C11: 175 | D11: =C11/B11 -> 58.333333333333336 | K11: 100 | L11: 50 | M11: 25
A12: Pérez, Ernesto | B12: 13 | C12: 784 | D12: =C12/B12 -> 54.8 | E12: 25 | F12: 100 | G12: 100 | H12: 33 | J12: 100 | K12: 14 | L12: 33 | M12: 10 | N12: 33 | O12: 100 | P12: 100 | Q12: 36 | R12: 100

A1: CIRCUITO DE RÁPIDAS | B1: TX | C1: CR | D1: % | E1: eberl | F1: estei | G1: nicap | H1: escla | I1: nisae | J1: nimzo | K1: nimzo | L1: esjae | M1: españ | N1: ¿?
A2: Alonso, Justo José | B2: 2 | C2: 45 | D2: =C2/B2 -> 22.5 | F2: 25 | G2: 20
A3: Andión, Jose Manuel | B3: 10 | C3: 378 | D3: =C3/B3 -> 39.6 | E3: 25 | F3: 20 | G3: 33 | H3: 100 | I3: 20 | J3: 61 | K3: 33 | L3: 20 | M3: 25 | N3: 41
A4: Andión, Manuel | B4: 9 | C4: 166 | D4: =C4/B4 -> 16.4 | E4: 17 | F4: 14 | G4: 17 | H4: 17 | I4: 17 | J4: 25 | K4: 25 | L4: 17 | M4: 17
A5: Conde, Francisco | B5: 2 | C5: 66 | D5: =C5/B5 -> 33 | F5: 33 | I5: 33
A6: Domínguez, Santiago | B6: 10 | C6: 536 | D6: =C6/B6 -> 56.6 | E6: 50 | F6: 50 | G6: 50 | H6: 33 | I6: 100 | J6: 61 | K6: 50 | L6: 50 | M6: 50 | N6: 42
A7: Iglesias, Alfonso | B7: 1 | C7: 50 | D7: =C7/B7 -> 50 | H7: 50
A8: López, Héctor | B8: 4 | C8: 245 | D8: =C8/B8 -> 61.25 | F8: 100 | G8: 100 | H8: 20 | I8: 25
A9: Martínez, Luis Carlos | B9: 3 | C9: 158 | D9: =C9/B9 -> 53 | L9: 100 | M9: 33 | N9: 25
A10: Medín, Diego | B10: 2 | C10: 31 | D10: =C9/B9 -> 16 | N10: 17
A11: Patiño, Luis | B11: 1 | C11: 33 | D11: =C9/B9 -> 33 | E11: 33
A12: Pena, José Luis | B12: 4 | C12: 173 | D12: =C10/B10 -> 43 | E12: 20 | L12: 33 | M12: 100 | N12: 20
A13: Pérez, Ernesto | B13: 10 | C13: 523 | D13: =C11/B11 -> 43.4 | E13: 100 | F13: 17 | G13: 25 | H13: 25 | I13: 50 | J13: 61 | K13: 100 | L13: 25 | M13: 20 | N13: 100