A1: 1º LUIS CARLOS MARTÍNEZ | B1: 753 | C1: 68
A2: 2º JAVIER MAZAIRA | B2: 685 | C2: 76
A3: 3º SANTIAGO DOMÍNGUEZ | B3: 563 | C3: 38
A4: 4º ERNESTO PÉREZ

A1: NOME | B1: TX | C1: CB | D1: % | E1: AG-RAP | F1: AG-SEM | G1: DO-VRO | H1: PA-FIS | I1: RAP-CC | J1: UA-OUT | K1: CD-MAR | L1: AG-ANI | M1: AG-NAD | N1: AG-RAG | O1: damas | P1: DO-XXV | Q1: DCC | R1: SEMGAG | S1: SDTSD | T1: TDVER | U1: TSMAR
A2: Alonso, Justo | B2: =COUNT(E2:U2) -> 3 | C2: =SUM(E2:U2) -> 34 | D2: =C2/B2 -> 11.333333333333334 | E2: 12 | F2: 11 | N2: 11
A3: Andión, José Manuel | B3: =COUNT(E3:U3) -> 9 | C3: =SUM(E3:U3) -> 240 | D3: =C3/B3 -> 26.666666666666668 | E3: 20 | G3: 17 | H3: 100 | J3: 7 | K3: 5 | N3: 13 | P3: 20 | Q3: 33 | S3: 25
A4: Andión, Manuel | B4: =COUNT(E4:U4) -> 6 | C4: =SUM(E4:U4) -> 56 | D4: =C4/B4 -> 9.3333333333333339 | H4: 10 | J4: 7 | K4: 5 | N4: 14 | Q4: 9 | S4: 11
A5: Bouzas, Juan | B5: =COUNT(E5:U5) -> 7 | C5: =SUM(E5:U5) -> 111 | D5: =C5/B5 -> 15.857142857142858 | F5: 12 | J5: 17 | K5: 7 | M5: 25 | S5: 13 | T5: 17 | U5: 20
A6: Conde, Francisco | B6: =COUNT(E6:U6) -> 10 | C6: =SUM(E6:U6) -> 237 | D6: =C6/B6 -> 23.7 | E6: 17 | F6: 17 | G6: 33 | H6: 25 | I6: 20 | J6: 8 | N6: 33 | P6: 50 | R6: 17 | S6: 17
A7: Domínguez, Santiago | B7: =COUNT(E7:U7) -> 15 | C7: =SUM(E7:U7) -> 563 | D7: =C7/B7 -> 37.533333333333331 | E7: 14 | F7: 25 | G7: 50 | H7: 33 | I7: 50 | J7: 14 | K7: 8 | L7: 50 | M7: 20 | O7: 100 | P7: 33 | Q7: 50 | R7: 33 | S7: 33 | U7: 50
A8: Gómez, José Ramón | B8: =COUNT(E8:U8) -> 1 | C8: =SUM(E8:U8) -> 17 | D8: =C8/B8 -> 17 | K8: 17
A9: González, Florencio | B9: =COUNT(E9:U9) -> 5 | C9: =SUM(E9:U9) -> 188 | D9: =C9/B9 -> 37.6 | E9: 33 | G9: 25 | K9: 5 | L9: 25 | P9: 100
A10: Iglesias, Alfonso | B10: =COUNT(E10:U10) -> 0 | C10: =SUM(E10:U10) -> 0 | D10: -
A11: López, Héctor | B11: =COUNT(E11:U11) -> 7 | C11: =SUM(E11:U11) -> 229 | D11: =C11/B11 -> 32.714285714285715 | F11: 33 | H11: 17 | L11: 100 | R11: 20 | S11: 20 | T11: 25 | U11: 14
A12: Martínez, Luis Carlos | B12: =COUNT(E12:U12) -> 11 | C12: =SUM(E12:U12) -> 753 | D12: =C12/B12 -> 68.454545454545453 | E12: 100 | F12: 50 | G12: 100 | H12: 50 | I12: 100 | J12: 20 | M12: 100 | Q12: 100 | R12: 50 | S12: 50 | U12: 33
A13: Mazaira, Javier | B13: =COUNT(E13:U13) -> 9 | C13: =SUM(E13:U13) -> 685 | D13: =C13/B13 -> 76.111111111111114 | E13: 50 | F13: 100 | J13: 25 | K13: 10 | N13: 100 | R13: 100 | S13: 100 | T13: 100 | U13: 100
A14: Mouriño, David | B14: =COUNT(E14:U14) -> 1 | C14: =SUM(E14:U14) -> 4 | D14: =C14/B14 -> 4 | K14: 4
A15: Muiños, Iago | B15: =COUNT(E15:U15) -> 2 | C15: =SUM(E15:U15) -> 31 | D15: =C15/B15 -> 15.5 | I15: 14 | N15: 17
A16: Patiño, Luis | B16: =COUNT(E16:U16) -> 3 | C16: =SUM(E16:U16) -> 54 | D16: =C16/B16 -> 18 | J16: 9 | N16: 25 | T16: 20
A17: Pena, Enrique | B17: =COUNT(E17:U17) -> 1 | C17: =SUM(E17:U17) -> 14 | D17: =C17/B17 -> 14 | F17: 14
A18: Pena, José Luis | B18: =COUNT(E18:U18) -> 9 | C18: =SUM(E18:U18) -> 193 | D18: =C18/B18 -> 21.444444444444443 | H18: 20 | I18: 13 | K18: 6 | L18: 20 | M18: 50 | N18: 20 | P18: 25 | Q18: 14 | U18: 25
A19: Pérez, Ernesto | B19: =COUNT(E19:U19) -> 14 | C19: =SUM(E19:U19) -> 367 | D19: =C19/B19 -> 26.214285714285715 | E19: 25 | F19: 20 | G19: 20 | H19: 14 | I19: 33 | J19: 8 | L19: 33 | M19: 33 | N19: 50 | O19: 50 | P19: 17 | Q19: 25 | R19: 25 | S19: 14